<?xml version="1.0" encoding="UTF-8"?>
<!DOCTYPE TheBigBandTheory SYSTEM "d.dtd">

<TheBigBandTheory>
    <info-gral>
          <genere>comèdia</genere>
          <pais>USA</pais>
          <director>Chuck Lorre</director>
          <director>Bill Prady</director>
          <canal>CBS</canal>
          <numtemporades>11</numtemporades>
          <format-imatge>480i</format-imatge>
          <format-imatge>1080i</format-imatge>
    </info-gral>
    <personatges>
          <personatge idP="A">
              <nom>Dr. Leonard Hofstadter</nom>
              <actor>Johnny Galecki</actor>
          </personatge>
          <personatge idP="B">
              <nom>Dr. Sheldon Cooper</nom>
              <actor>Jim Parsons</actor>
          </personatge> 
          <personatge idP="C">
              <nom>Penny </nom>
              <actor>Kaley Cuoco</actor>
          </personatge>
          <personatge idP="D">
              <nom>Howard Joel Wolowitz</nom>
              <actor>Simon Helberg</actor>
          </personatge> 
          <personatge idP="E">
              <nom>Dr. Rajesh Ramayan Koothrappali</nom>
              <actor>Kunal Nayyar</actor>
          </personatge> 
    </personatges>
    <temporades>
          <temporada numT="_1" estrella="B">
              <data-inici>24/09/2007</data-inici>
              <milions-espectadors>9.52</milions-espectadors>
          </temporada>
          <temporada numT="_2">
              <data-inici>22/09/2008</data-inici>
              <milions-espectadors>8.58</milions-espectadors>
          </temporada>
          <temporada numT="_3" estrella="C">
              <data-inici>21/09/2009</data-inici>
              <milions-espectadors>8.36</milions-espectadors>
          </temporada>
          <temporada numT="_4">
              <data-inici>23/09/2010</data-inici>
              <milions-espectadors>8.15</milions-espectadors>
          </temporada>
          <temporada numT="_5" estrella="C">
              <data-inici>22/09/2011</data-inici>
              <milions-espectadors>8.81</milions-espectadors>
          </temporada>
          <temporada numT="_6">
              <data-inici>27/09/2012</data-inici>
              <milions-espectadors>8.92</milions-espectadors>
          </temporada>
          <temporada numT="_7">
              <data-inici>26/09/2013</data-inici>
              <milions-espectadors>9.68</milions-espectadors>
          </temporada>
          <temporada numT="_8" estrella="B">
              <data-inici>22/09/2014</data-inici>
              <milions-espectadors>9.32</milions-espectadors>
          </temporada>
          <temporada numT="_9">
              <data-inici>21/09/2015</data-inici>
              <milions-espectadors>9.11</milions-espectadors>
          </temporada>
          <temporada numT="_10">
              <data-inici>19/09/2016</data-inici>
              <milions-espectadors>8.63</milions-espectadors>
          </temporada>
          <temporada numT="_11">
              <data-inici>25/09/2017</data-inici>
              <milions-espectadors>8.68</milions-espectadors>
          </temporada>
    </temporades>
</TheBigBandTheory>
